url,title,des,site,time
http://tech.sina.com.cn/i/2015-11-18/doc-ifxksqiu1667542.shtml,唯品会公布第三季度财报:净利同比增90%,"新浪科技  2015年11月18日 06:00新浪科技讯北京时间11月18日凌晨消息,唯品会(NYSE:VIPS)今天发布了截至9月30日的2015财年第三季度未经审计财报。报告显示,唯品会第三季度总净营收为人民币86.7...  百度快照",新浪科技,2015年11月18日
http://it.sohu.com/20151116/n426554762.shtml,唯品会发布三季度财报预警 股票一度跌幅超30%,"搜狐科技  2015年11月16日 08:57 自从上市以来,唯品会连续11个季度高速增长。但现在看来,这个趋势要终结了。唯品会11月13日晚间发布了业绩预警:2015年第三季度营收为86亿到87  百度快照",搜狐科技,2015年11月16日
http://tech.qq.com/a/20150514/062787.htm,唯品会高管解读财报:海淘业务有很大增长空间,"腾讯科技  2015年05月14日 22:00唯品会高管解读财报:海淘业务有很大增长空间 沈亚称,唯品会目前经营的品类做跨境电商也非常合适。  百度快照",腾讯科技,2015年05月14日
http://money.163.com/15/0514/16/APJD05PO00253B0H.html,唯品会回应做空:根本没弄明白我们的商业模式,"网易财经  2015年05月14日 16:14【TechWeb报道】5月14日消息,唯品会针对国外做空机构有关其财务造假一事做出了正面回应,指出做空机构不懂唯品会的商业模式,指责毫无根据、存在大量与事实不符之处...  7条相同新闻  -  百度快照",网易财经,2015年05月14日
http://business.sohu.com/20150512/n412885264.shtml,中概股也有“妖股” 唯品会上市三年涨69倍,"搜狐财经  2015年05月12日 09:25自上市以来,唯品会股价已经上涨69倍,股价一度超过百度成为最贵中概股,目前市值高达160亿美元,市盈率高达116倍。 数据显示,唯品会2014财年营收、净利润分别为37.7...  3条相同新闻  -  百度快照",搜狐财经,2015年05月12日
http://tech.qq.com/a/20150424/052681.htm,唯品会回应信息泄露事件:骗子强行“撞库”,"腾讯科技  2015年04月24日 16:00唯品会回应信息泄露事件:骗子强行“撞库” 唯品会表示,客户资料已进行加密监控,绝不会泄露给第三方。  百度快照",腾讯科技,2015年04月24日
http://news.163.com/15/0421/03/ANMOMK6M00014Q4P.html,炮轰对方卖假货 聚美优品与唯品会掐起来了,"网易新闻  2015年04月21日 03:19这边厢是58和赶集的其乐融融,那一头,聚美优品突然就和唯品会“掐”了起来。4月17日晚间,聚美优品高级副总裁刘惠璞发微博指责唯品会涉嫌售假、盗用授权、抄袭...  百度快照",网易新闻,2015年04月21日
http://www.infzm.com/content/109055,电商“撕逼”聚美炮轰唯品会抄袭售假 唯品会否认,"南方周末  2015年04月20日 17:52这个周末,聚美优品和唯品会“撕逼”了。... 这个周末,聚美优品和唯品会“撕逼”了。 4月17日晚间,聚美优品公司高级副总裁刘惠璞发微博称,公司进口了一批韩国美妆...  百度快照",南方周末,2015年04月20日
http://money.163.com/15/0420/11/ANL0UEAR002526O3.html,聚美副总裁炮轰唯品会售假 业内:不掺假赚不了钱,"网易财经  2015年04月20日 11:46唯品会旗下乐蜂网涉嫌走私售假一事尚未平息,4月17日,聚美优品高级副总裁刘惠璞微博“炮轰”唯品会涉嫌售假、抄袭聚美海外购页面,包括产品介绍、文案详情、模特头像...  11条相同新闻  -  百度快照",网易财经,2015年04月20日
http://www.guangyuanol.cn/news/newssogou/2016/0930/650820.html,唯品会哥弟Girdear女装专场 秋季摩登演绎,"川北在线  2016年09月30日 15:08原标题:唯品会哥弟Girdear女装专场 秋季摩登演绎 唯品会哥弟Girdear女装专场,型尚秋季,摩登演绎,9月29日,全场1.8折起。 哥弟,源自中国台湾,创始于1977年,本着...  百度快照",川北在线,2016年09月30日
http://news.163.com/15/0418/14/ANG6RJNE00014AEE.html,419惊喜不止一夜 唯品会“全球特卖”明星爆款吐血推荐,"网易新闻  2015年04月18日 14:38当然,如果你有其他一直想“拔草”却因为价格、服务、运费等原因一直没拔成的心水之物,也不妨来唯品会“419”特卖狂欢节逛逛。“一场史无前例的全球特卖”可不...  3条相同新闻  -  百度快照",网易新闻,2015年04月18日
http://tech.qq.com/a/20150418/016561.htm,唯品会回复聚美炮轰:我们的商品是正品,"腾讯科技  2015年04月18日 10:00唯品会回复聚美炮轰:我们的商品是正品 唯品会称,问题主要是因为对供应商提供的页面设计审核不严,但产品没任何问题。  百度快照",腾讯科技,2015年04月18日
http://tech.qq.com/a/20150417/065728.htm,聚美优品炮轰唯品会:涉嫌售假和盗用授权,"腾讯科技  2015年04月17日 23:00聚美优品炮轰唯品会:涉嫌售假和盗用授权 聚美方称,已发出律师函,要求唯品会立即下线侵权文案,并公开赔礼道歉。  2条相同新闻  -  百度快照",腾讯科技,2015年04月17日
http://news.163.com/15/0416/16/ANBAIB7700014AEE.html,唯品会第三年“419”来袭 一场史无前例的全球特卖,"网易新闻  2015年04月16日 15:00近日,全球最大特卖网站唯品会宣布将一年一度的4.19特卖节升级“一场史无前例的全球特卖 会”,率先揭开2015年电商造节的序幕。据悉,今年的419唯品会将精选来自...  2条相同新闻  -  百度快照",网易新闻,2015年04月16日
http://tech.qq.com/a/20150414/015240.htm,唯品会500万美元战略投资特卖电商Ensogo,"腾讯科技  2015年04月14日 08:00唯品会500万美元战略投资特卖电商Ensogo Ensogo于2013年12月在澳洲证券交易所上市,为东南亚超过6亿用户提供特价产品。  百度快照",腾讯科技,2015年04月14日
http://finance.sina.com.cn/consume/puguangtai/20150331/232221857830.shtml,唯品会上买到开裂鞋疑为假货 三方各执一词维权难,"新浪财经  2015年03月31日 23:00唯品会上买到开裂“正品鞋后 法治周末记者蔡长春 因为怀疑自己在唯品会上买到的运动鞋不是正品,深圳消费者武强进行了长达半年多时间的求证。时至今日,该问题未能...  百度快照",新浪财经,2015年03月31日
http://tech.163.com/15/0331/14/AM1TDG27000915BF.html,唯品会宣布高级副总裁蒋泾辞职,"网易科技  2015年03月31日 14:49网易科技讯 3月31日消息,据美国媒体报道,唯品会当日宣布,蒋泾(Alex Jing Jiang)先生正式提出辞去公司商业情报和客户关系管理高级副总裁职务,生效日期为2015年3月31...  百度快照",网易科技,2015年03月31日
http://finance.ifeng.com/a/20150318/13562695_0.shtml,唯品会做贴近消费者生活的内容营销,"凤凰网  2015年03月18日 14:00冯佳路,唯品会副总裁,冯佳路先生拥有丰富的营销管理经验,曾任宝洁旗下玉兰油大中华区品牌总监,以及知名公关公司万博宣伟顾问。拥有北京外国语大学经济学和英语文学双...  2条相同新闻  -  百度快照",凤凰网,2015年03月18日
http://tech.gmw.cn/2016-01/06/content_18378177.htm,唯品会“销售假茅台”再发酵 消协发函呼信息公开,"光明网  2016年01月06日 08:00唯品会解决方案仍存三大问题,应公示产品质量检测结果,公布涉事供应商的具体信息和供应商提供的其他商品信息  百度快照",光明网,2016年01月06日
http://zennew.baijia.baidu.com/article/47905,唯品会2014年财报解析,"百度百家  2015年03月03日 12:44所以,整体来说,唯品会2014年表现还是非常不错的。全年营收增长122.42%,于此同时,商品成本119.98%,这也意味着,唯品会的毛利空间更大了! 正因为毛利空间更大了,...  2条相同新闻  -  百度快照",百度百家,2015年03月03日
http://tech.sina.com.cn/zl/post/detail/i/2015-08-17/pid_8485622.htm,"关于唯品会,华尔街的投资者们又错了","新浪科技  2015年08月17日 16:00都说针对上市企业,市场上升时,看企业的“势”,下降时看“值”,其实,无论势和值,唯品会都不乏自己的硬功夫支撑。  百度快照",新浪科技,2015年08月17日
http://tech.sina.com.cn/i/2015-08-11/doc-ifxftkpx3771455.shtml,唯品会高管解读财报:美妆是未来重要主打品类,"新浪科技  2015年08月11日 22:00新浪科技讯北京时间8月11日晚间消息,唯品会(NYSE:VIPS)今天发布了截至6月30日的2015财年第二季度未经审计的财报。报告显示,唯品会第二季度总净营收为90亿元人民...  2条相同新闻  -  百度快照",新浪科技,2015年08月11日
http://www.techweb.com.cn/internet/2015-11-19/2228048.shtml,消息称唯品会将被腾讯收购或入股遭唯品会否认,"Techweb  2015年11月19日 07:00【TechWeb报道】11月19日消息,昨日有消息爆料称,腾讯将收购或投资唯品会。对此,唯品会向媒体否认了这一消息。  2条相同新闻  -  百度快照",Techweb,2015年11月19日
http://www.jiemian.com/article/439256.html,唯品会发布第三季度财报预警 股票一度跌幅超过30%,"界面新闻  2015年11月14日 12:00这是唯品会自上市以来第一次发布业绩预警。... 唯品会11月13日晚间发布了业绩预警:2015年第三季度营收为86亿到87亿元,年增长为61%到63%,唯品会此前的预计是,年...  百度快照",界面新闻,2015年11月14日
http://news.163.com/15/0115/18/AG16DNR800014AEE.html,唯品会注“唯品会.手机” 欲引发电商加速竞争,"网易新闻  2015年01月15日 16:00日前,有商家反映,唯品会为了全面应对移动端的竞争,已将团购频道从PC端全面下线,并将业务都转移至移动客户端。与之同时,唯品团每天会推出一款 特价产品在手机端销售...  百度快照",网易新闻,2015年01月15日
http://finance.cnr.cn/315/gz/20151103/t20151103_520376882.shtml,唯品会“贵重物品不能无理由退货”站得住脚吗?,"央广网  2015年11月03日 13:00消费者在唯品会购买首饰,收货后不满意想要退货,客服回应“贵重物品不能无理由退货”。消费者则说自己购买时确认了网页上有“支持7天无理由退换”字样,退货时才不...  百度快照",央广网,2015年11月03日
http://www.ebrun.com/20160102/161055.shtml?mType=Group,唯品会发布声明承认售假 涉案人已被刑拘,"亿邦动力网  2016年01月02日 08:07唯品会在2015年最后一天发布声明,证实平台销售假茅台,对已退货的商品进行封存并移交相关部门调查和鉴定。  百度快照",亿邦动力网,2016年01月02日
http://www.linkshop.com.cn/web/archives/2015/340227.shtml,唯品会连续三年盈利凭什么 神股有三大杀器,"联商网  2015年12月19日 11:002008年成立的唯品会几乎是唯一的例外,不但活下来了,而且活得很好,除了平台电商阿里系之外,唯品会是唯一一家实现了持续盈利的电商,也是全球唯一一家实现了12季度...  3条相同新闻  -  百度快照",联商网,2015年12月19日
http://www.gfan.com/news/2015121779174.html,唯品会售假茅台?茅台回应声明打击侵权,"机锋网  2015年12月17日 10:00对唯品会上销售的相关产品,茅台、五粮液相关人士均向《每日经济新闻》记者称,与唯品会没有合作。茅台酒销售公司相关负责人表示,“一些电商平台跟茅台没有合作,他们...  百度快照",机锋网,2015年12月17日
http://it.sohu.com/20150616/n415140056.shtml,张勇:天猫顺手养活了京东唯品会 现在要收网,"搜狐科技  2015年06月16日 21:38搜狐科技消息阿里巴巴集团CEO张勇今日表示:“这6年,天猫双十一顺手养活了京东和唯品会,商家在双十一卖剩下的商品跑到京东唯品会,成就了他们的商业模式。现在是时候  百度快照",搜狐科技,2015年06月16日
http://www.ebrun.com/20151214/158904.shtml,探秘唯品会自动化仓储系统 日处理9.6万件,"亿邦动力网  2015年12月14日 11:13唯品会正式对外曝光其最新上线的自动化仓储系统——“蜂巢式电商4.0系统”,该系统全程机器拣货,在存储量、订单处理速度上都全面“开挂”。  2条相同新闻  -  百度快照",亿邦动力网,2015年12月14日
http://www.chinaz.com/biz/2015/1208/480640.shtml,唯品会被逼放大招?中国电商未来可能只剩京东和阿里争霸!,"站长之家  2015年12月08日 16:00唯品会股价下跌和假货风波背后,其实是中国电商的集体症结。随着经济下行,电商会暴露出越来越多的问题。唯品会此次解决问题的关键点放在了互联网金融上,然而,与其紧密相  百度快照",站长之家,2015年12月08日
http://www.chinaz.com/news/2015/1126/475441.shtml,"声称100%正品的唯品会,逃不过成为下一个聚美优品?","站长之家  2015年11月26日 08:00近日,唯品会公布第三季度财报,财报显示唯品会在第三季度实现营收86.7亿元,比去年同期增长63%,净赚3.17亿,据悉加上此季度的增长,唯品会已经连续12个季度实现盈利...  2条相同新闻  -  百度快照",站长之家,2015年11月26日
http://tech.sina.com.cn/zl/post/detail/i/2015-05-15/pid_8478842.htm,唯品会被做空:收入确认方式真有猫腻?,"新浪科技  2015年05月15日 15:00由于收入确认是所有中概股公司的核心会计事项,如果收入确认出现了重大问题,那么公司的整个财务报表就失去了公允性,因此对唯品会收入确认的质疑也是这次做空报告的核心...  百度快照",新浪科技,2015年05月15日
http://tech.sina.com.cn/i/2015-05-14/doc-icczmvup1722082.shtml,唯品会高管解读2015财年第一季度财报,"新浪科技  2015年05月14日 22:00新浪科技讯北京时间5月14日晚间消息,唯品会(NYSE:VIPS)今天发布了截至3月31日的2015财年第一季度未经审计财报。报告显示,唯品会第一季度总净营收为人民币86亿元(...  百度快照",新浪科技,2015年05月14日
http://www.ebrun.com/20151118/156023.shtml,唯品会2015第三季财报:回头客订单占92.5%,"亿邦动力网  2015年11月18日 10:55根据财报,唯品会2015年第三季度实现净营收86.7亿元人民币,同比增长达63%,实现12个季度持续盈利。  2条相同新闻  -  百度快照",亿邦动力网,2015年11月18日
http://www.chinaz.com/news/2015/1125/474903.shtml,腾讯和京东都要收购唯品会?谣传背后藏着多个惊人秘密!,"站长之家  2015年11月17日 00:00腾讯很可能收购唯品会,唯品会不会答应阿里收购,百度最应该收购唯品会。乱不乱?唯品会应该选谁?11月17日的时候,网上疯传这样一条消息:腾讯要收购唯品会以及腾讯和...  2条相同新闻  -  百度快照",站长之家,2015年11月17日
http://www.ebrun.com/20151116/155757.shtml,唯品会双11销售额是去年3倍 移动端占80%,"亿邦动力网  2015年11月16日 11:51【亿邦动力网讯】11月16日消息,据唯品会官方透露,截至11月11日20时,唯品会“双11”销售额(点击进入>>双十一回顾专题)已达到了去年的3倍,其中,移动端的成交量...  百度快照",亿邦动力网,2015年11月16日
http://finance.ifeng.com/a/20141114/13275951_0.shtml,独家电商合作伙伴 唯品会携手宝洁美尚“未来视界”趋势发布,"凤凰网  2014年11月14日 17:00今年以来,唯品会发力美妆,与宝洁中国正式达成战略合作,双方携手开展业务合作、市场推广、消费者调研和联合人才培养。此前,唯品会已陆续与宝洁旗下多个品牌达成合作,...  百度快照",凤凰网,2014年11月14日
http://city.china.com/baike_5ZSv5ZOB5Lya.html,唯品会 - 唯品会相关新闻_图片_视频_网友讨论_城市频道_中华网,"中华网  2016年01月15日 08:24中华网城市频道为您提供唯品会聚合阅读,主要包括最新的唯品会相关新闻,唯品会图片,唯品会视频,唯品会评论,还能参与网友对唯品会的热门讨论.  百度快照",中华网,2016年01月15日
http://finance.takungpao.com/dujia/2016-01/3267425.html,屡屡被曝售假 唯品会何以变成“伪品会”?,"大公网  2016年01月13日 11:21日前,声称“100%正品特卖”的唯品会惨遭“打脸”,先后被曝出成为假冒瑞士手表生产商的销售平台以及销售假茅台。售假事件愈演愈烈,新华社和中消协曾经先后发文指责...  百度快照",大公网,2016年01月13日
http://digi.dnkb.com.cn/dnkb/html/2016-01/08/content_408539.htm,唯品会陷困局,"东南快报  2016年01月08日 05:05数字报,东快网,东南快报官方网站,福建本土资讯门户,24小时即时新闻,体育,娱乐,论坛,搜城,数码,汽车,财经,房产,健康,教育,福建省贸促会主办,以福州、厦门为中心,...  3条相同新闻  -  百度快照",东南快报,2016年01月08日
http://tech.qq.com/a/20141104/083151.htm,唯品会今日起拆股,"腾讯科技  2014年11月04日 23:00唯品会今日起拆股 从之前的每股ADS代表2股普通股,调整为5股ADS代表一股普通股。... 唯品会上月宣布了拆股计划,从之前的每股ADS代表2股普通股,调整为5股ADS代...  百度快照",腾讯科技,2014年11月04日
http://finance.sina.com.cn/stock/usstock/newstock/20141104/020020720508.shtml,唯品会的金融生态圈,"新浪财经  2014年11月04日 02:00与阿里、京东、苏宁等电商平台一样,在主营业务渐渐稳固之后,唯品会也把触角伸向了金融领域。目前,唯品会已下设一家保理公司、两家小贷公司,其第三方支付牌照也在...  10条相同新闻  -  百度快照",新浪财经,2014年11月04日
http://www.ah.xinhuanet.com/2015-10/28/c_1116962196.htm,唯品会开拓仓储无线网络技术 备战“双十一”,"新华网安徽站  2015年10月28日 11:08    面对即将到来的“双十一”购物狂欢,特卖电商唯品会在网络技术方面也是做足了功夫。众所周知,唯品会的仓储面积已从2008年的10平方米增至目前的140万...  百度快照",新华网安徽站,2015年10月28日
http://www.iwshang.com/Post/Default/Index/pid/42017.html,竟然卖假茅台?唯品会承认了……,"锦程物流网  2016年01月05日 10:33摘要:2015年11月开始,以承诺“100%正品”见知于消费者的唯品会便涉嫌售卖假冒奢侈品,新年伊始,假货事件持续发酵,“假茅台”重新将唯品会推向风口浪尖。 整理/天下...  5条相同新闻  -  百度快照",锦程物流网,2016年01月05日
http://www.ebrun.com/20151026/153208.shtml,为双十一 唯品会连海关都打好招呼了,"亿邦动力网  2015年10月26日 12:02唯品会作为电商老三虽然一再强调自个儿4·18的周年庆,不愿丢面儿,但更不愿看着自家流量哗哗流入别人家的花园。  百度快照",亿邦动力网,2015年10月26日
http://www.chinaz.com/manage/2015/1026/461890.shtml,"同样是做特卖,为什么唯品会不提供搜索功能?","站长之家  2015年10月26日 10:00综上,唯品会虽然做线上销售,但是还是从产品的本质,消费群体的特点上来运营,而不是单纯的跟电商网站运营的工具去运营;再者主打化妆品,产品是垂直型的,大大降低了...  百度快照",站长之家,2015年10月26日
http://money.163.com/14/1031/22/A9TSQ89K002554A4.html,唯品会副总裁马晓辉荣获长城奖十大功勋人物,"网易财经  2014年10月31日 22:59唯品会副总裁马晓辉荣获2014中国广告长城奖•广告主奖·十大功勋人物2014年10月26日下午,“2014中国广告长城奖·广告主奖”颁奖盛典在贵阳国际会议展览中心举办的第...  百度快照",网易财经,2014年10月31日
http://www.ebrun.com/20151021/152824.shtml,武迪:唯品会海外精选日订单量超7万,"亿邦动力网  2015年10月21日 18:40【亿邦动力网讯】10月21日消息,在亿邦动力网联合主办的2015中部(郑州)跨境电子商务发展峰会上,唯品会物流发展有限公司副总经理武迪透露,目前唯品会的海外精选业务日...  百度快照",亿邦动力网,2015年10月21日
http://www.ebrun.com/20151020/152529.shtml,深度揭秘唯品会自建物流:比你想象的可怕,"亿邦动力网  2015年10月20日 07:36唐倚智透露,唯品会已经成立了全资控股的品骏物流公司,快递员已有1.5万人,实现了全国无盲点覆盖。  2条相同新闻  -  百度快照",亿邦动力网,2015年10月20日
http://suyi.baijia.baidu.com/article/272917,"冯佳路:连续12个季度盈利后,唯品会将这样继续走着","百度百家  2015年12月22日 19:232008年成立的唯品会几乎是唯一的例外,不仅活了下来,而且实现了创业界纪录的12个季度连续盈利。 唯品会“特立独行”背后的原因有哪些?接下来又将如何应对消费升级与...  百度快照",百度百家,2015年12月22日
http://tanhaisheng.baijia.baidu.com/article/268475,唯品会又被曝售假?茅台:你已经成功引起了我的注意,"百度百家  2015年12月18日 12:46小爆今天要跟大家聊的是最近又陷入售假风波的唯品会。 没错,是“又”陷入售假风波的唯品会。 凭借“精选品牌+深度折扣+限时抢购”的正品特卖模式,成为中国三大...  百度快照",百度百家,2015年12月18日
http://finance.takungpao.com/dujia/2015-12/3255080.html,电商假茅台疑云:唯品会将退货退款 茅台声明打击侵权,"大公网  2015年12月17日 07:20按照平均600元的促销单价计,此次唯品会销售的问题茅台酒涉及金额将达54万元。... 大公财经12月17日讯 唯品会(NYSE:VIPS)日前被爆出“销售假冒茅台”消息。昨日上午...  2条相同新闻  -  百度快照",大公网,2015年12月17日
http://tech.huanqiu.com/internet/2015-12/8192633.html,唯品会公然卖假茅台!官方闪烁其词,环球网  2015年12月16日 16:00市值近百亿美金的唯品会的突然因为一篇网帖陷入销售假茅台酒风波。... 国内最大的电商平台之一、市值近百亿美金的唯品会的突然因为一篇网帖陷入销售假茅台酒风波。 ...  百度快照,环球网,2015年12月16日
http://www.nofashion.cn/a/1450254219276.html,唯品会再爆售假 一个月内第二次 涉嫌销售假茅台酒,"无时尚中文网  2015年12月16日 16:39(NYSE:VIPS) 唯品会一个月内第二次被爆售假,继上月被腾讯网报道成为假冒瑞士手表生产商黎明表业的销售平台之一后,本周更是被爆销售假冒知名白酒品牌茅台酒。 ...  2条相同新闻  -  百度快照",无时尚中文网,2015年12月16日
http://www.ocn.com.cn/keji/201512/dpntc03102632.shtml,唯品会12.8电影票兑换券在哪?唯品会12.8电影票怎么买?,"中国投资咨询网  2015年12月03日 10:00唯品会12.08周年庆不仅给大家提供了各类商品的优惠,用户还可以使用唯品会购买12.8元3d电影票,唯品会12.8电影票兑换券在哪,唯品会12.8电影票怎么买,下面小编就...  百度快照",中国投资咨询网,2015年12月03日
http://news.ikanchai.com/2015/1202/39754.shtml,"百度or腾讯,谁会吸干唯品会的最后一滴血?","砍柴网  2015年12月02日 23:00如果借机投靠腾讯阵营,等待唯品会的则一定是不成功则成仁。这一点可以参考易迅网、好乐买等独立电商的发展。而且对于唯品会来说,相比一直不盈利、模式笨重的京东,...  百度快照",砍柴网,2015年12月02日
http://news.zj.com/detail/2015/11/27/1594586.html,唯品会感谢有你 衷心回馈感恩在行动,"浙江都市网  2015年11月27日 10:00唯品会感谢有你,衷心回馈——神秘惊喜答谢你主题活动,在11月25日20:00开启至11月27日9:59结束。感恩..浙江都市网报道-中新网浙江站  百度快照",浙江都市网,2015年11月27日
http://info.texnet.com.cn/content/2015-11-27/531248.html,涉嫌售卖假冒奢侈品 唯品会业绩下滑股票断崖式暴跌,"中国纺织网  2015年11月27日 08:15据Bloomberg消息,对冲基金近期大幅减持唯品会股票,撤出中国电商市场投资。第三... 据Bloomberg消息,对冲基金近期大幅减持唯品会股票,撤出中国电商市场投资。第三季度,对冲...  2条相同新闻  -  百度快照",中国纺织网,2015年11月27日
http://tanhaisheng.baijia.baidu.com/article/244394,唯品会被曝售假背后或另有隐情,"百度百家  2015年11月26日 10:2911月25日,腾讯科技发布的原创新闻调查《唯品会涉嫌售卖假冒奢侈品》引发众人关注。随后唯品会发布公告直指腾讯造谣。11月25日一大早,腾讯科技发布的原创新闻调查《...  百度快照",百度百家,2015年11月26日
http://www.nofashion.cn/a/1448430903446.html,上市来最大危机:唯品会被爆售假 销售放缓 投资者摇摆,"无时尚中文网  2015年11月25日 13:03(NYSE:VIPS) 唯品会随后发布声明予以否认。唯品会称公司并未与报道中销售假冒瑞士手表的黎明表业有业务合作;而针对腾讯网关于唯品会多数商品没有品牌授权的报道,唯品...  2条相同新闻  -  百度快照",无时尚中文网,2015年11月25日
